{"matchId": "600cf5ad-2b1e-44b5-b122-5dc54ef2bb06.nakama-0", "mapId": "Lockdown", "collectionDay": "February_13", "humanCount": 1, "botCount": 0, "tsMin": 1770963256.0, "tsMax": 1770963316.0, "tsUnit": "ms", "events": [{"userId": "4f1a4ce1-70f6-43a5-bfc7-e446e44ee043", "actorKind": "human", "matchId": "600cf5ad-2b1e-44b5-b122-5dc54ef2bb06.nakama-0", "mapId": "Lockdown", "collectionDay": "February_13", "x": -85.74711608886719, "y": 49.59464645385742, "z": 216.24122619628906, "ts": 1770963256.0, "eventKind": "Position", "sourceFile": "February_13\\4f1a4ce1-70f6-43a5-bfc7-e446e44ee043_600cf5ad-2b1e-44b5-b122-5dc54ef2bb06.nakama-0"}, {"userId": "4f1a4ce1-70f6-43a5-bfc7-e446e44ee043", "actorKind": "human", "matchId": "600cf5ad-2b1e-44b5-b122-5dc54ef2bb06.nakama-0", "mapId": "Lockdown", "collectionDay": "February_13", "x": -68.08533477783203, "y": 46.447017669677734, "z": 220.33319091796875, "ts": 1770963276.0, "eventKind": "Position", "sourceFile": "February_13\\4f1a4ce1-70f6-43a5-bfc7-e446e44ee043_600cf5ad-2b1e-44b5-b122-5dc54ef2bb06.nakama-0"}, {"userId": "4f1a4ce1-70f6-43a5-bfc7-e446e44ee043", "actorKind": "human", "matchId": "600cf5ad-2b1e-44b5-b122-5dc54ef2bb06.nakama-0", "mapId": "Lockdown", "collectionDay": "February_13", "x": -36.09202575683594, "y": 44.85990905761719, "z": 227.1625213623047, "ts": 1770963281.0, "eventKind": "Position", "sourceFile": "February_13\\4f1a4ce1-70f6-43a5-bfc7-e446e44ee043_600cf5ad-2b1e-44b5-b122-5dc54ef2bb06.nakama-0"}, {"userId": "4f1a4ce1-70f6-43a5-bfc7-e446e44ee043", "actorKind": "human", "matchId": "600cf5ad-2b1e-44b5-b122-5dc54ef2bb06.nakama-0", "mapId": "Lockdown", "collectionDay": "February_13", "x": -10.786252975463867, "y": 43.180301666259766, "z": 232.13723754882812, "ts": 1770963286.0, "eventKind": "Position", "sourceFile": "February_13\\4f1a4ce1-70f6-43a5-bfc7-e446e44ee043_600cf5ad-2b1e-44b5-b122-5dc54ef2bb06.nakama-0"}, {"userId": "4f1a4ce1-70f6-43a5-bfc7-e446e44ee043", "actorKind": "human", "matchId": "600cf5ad-2b1e-44b5-b122-5dc54ef2bb06.nakama-0", "mapId": "Lockdown", "collectionDay": "February_13", "x": 14.702932357788086, "y": 38.866336822509766, "z": 237.80126953125, "ts": 1770963291.0, "eventKind": "Position", "sourceFile": "February_13\\4f1a4ce1-70f6-43a5-bfc7-e446e44ee043_600cf5ad-2b1e-44b5-b122-5dc54ef2bb06.nakama-0"}, {"userId": "4f1a4ce1-70f6-43a5-bfc7-e446e44ee043", "actorKind": "human", "matchId": "600cf5ad-2b1e-44b5-b122-5dc54ef2bb06.nakama-0", "mapId": "Lockdown", "collectionDay": "February_13", "x": 16.382680892944336, "y": 34.24281311035156, "z": 237.02096557617188, "ts": 1770963296.0, "eventKind": "Position", "sourceFile": "February_13\\4f1a4ce1-70f6-43a5-bfc7-e446e44ee043_600cf5ad-2b1e-44b5-b122-5dc54ef2bb06.nakama-0"}, {"userId": "4f1a4ce1-70f6-43a5-bfc7-e446e44ee043", "actorKind": "human", "matchId": "600cf5ad-2b1e-44b5-b122-5dc54ef2bb06.nakama-0", "mapId": "Lockdown", "collectionDay": "February_13", "x": 10.919341087341309, "y": 34.52458572387695, "z": 218.7995147705078, "ts": 1770963301.0, "eventKind": "Position", "sourceFile": "February_13\\4f1a4ce1-70f6-43a5-bfc7-e446e44ee043_600cf5ad-2b1e-44b5-b122-5dc54ef2bb06.nakama-0"}, {"userId": "4f1a4ce1-70f6-43a5-bfc7-e446e44ee043", "actorKind": "human", "matchId": "600cf5ad-2b1e-44b5-b122-5dc54ef2bb06.nakama-0", "mapId": "Lockdown", "collectionDay": "February_13", "x": 8.393754005432129, "y": 36.296695709228516, "z": 206.58580017089844, "ts": 1770963306.0, "eventKind": "Position", "sourceFile": "February_13\\4f1a4ce1-70f6-43a5-bfc7-e446e44ee043_600cf5ad-2b1e-44b5-b122-5dc54ef2bb06.nakama-0"}, {"userId": "4f1a4ce1-70f6-43a5-bfc7-e446e44ee043", "actorKind": "human", "matchId": "600cf5ad-2b1e-44b5-b122-5dc54ef2bb06.nakama-0", "mapId": "Lockdown", "collectionDay": "February_13", "x": 7.309709072113037, "y": 35.05368423461914, "z": 211.28598022460938, "ts": 1770963311.0, "eventKind": "Position", "sourceFile": "February_13\\4f1a4ce1-70f6-43a5-bfc7-e446e44ee043_600cf5ad-2b1e-44b5-b122-5dc54ef2bb06.nakama-0"}, {"userId": "4f1a4ce1-70f6-43a5-bfc7-e446e44ee043", "actorKind": "human", "matchId": "600cf5ad-2b1e-44b5-b122-5dc54ef2bb06.nakama-0", "mapId": "Lockdown", "collectionDay": "February_13", "x": 6.923486709594727, "y": 34.806034088134766, "z": 212.92579650878906, "ts": 1770963312.0, "eventKind": "BotKilled", "sourceFile": "February_13\\4f1a4ce1-70f6-43a5-bfc7-e446e44ee043_600cf5ad-2b1e-44b5-b122-5dc54ef2bb06.nakama-0"}, {"userId": "4f1a4ce1-70f6-43a5-bfc7-e446e44ee043", "actorKind": "human", "matchId": "600cf5ad-2b1e-44b5-b122-5dc54ef2bb06.nakama-0", "mapId": "Lockdown", "collectionDay": "February_13", "x": 6.92349100112915, "y": 34.79642868041992, "z": 213.09652709960938, "ts": 1770963316.0, "eventKind": "Position", "sourceFile": "February_13\\4f1a4ce1-70f6-43a5-bfc7-e446e44ee043_600cf5ad-2b1e-44b5-b122-5dc54ef2bb06.nakama-0"}]}