{"matchId": "99fbbc26-7d87-4ca2-9f3b-ce960169f035.nakama-0", "mapId": "Lockdown", "collectionDay": "February_13", "humanCount": 1, "botCount": 0, "tsMin": 1770980196.0, "tsMax": 1770980323.0, "tsUnit": "ms", "events": [{"userId": "0e070271-33e4-4cb8-9743-81fa26cab07f", "actorKind": "human", "matchId": "99fbbc26-7d87-4ca2-9f3b-ce960169f035.nakama-0", "mapId": "Lockdown", "collectionDay": "February_13", "x": -234.88938903808594, "y": 49.075260162353516, "z": 186.30670166015625, "ts": 1770980196.0, "eventKind": "Position", "sourceFile": "February_13\\0e070271-33e4-4cb8-9743-81fa26cab07f_99fbbc26-7d87-4ca2-9f3b-ce960169f035.nakama-0"}, {"userId": "0e070271-33e4-4cb8-9743-81fa26cab07f", "actorKind": "human", "matchId": "99fbbc26-7d87-4ca2-9f3b-ce960169f035.nakama-0", "mapId": "Lockdown", "collectionDay": "February_13", "x": -230.0354766845703, "y": 49.075260162353516, "z": 182.0168914794922, "ts": 1770980221.0, "eventKind": "Position", "sourceFile": "February_13\\0e070271-33e4-4cb8-9743-81fa26cab07f_99fbbc26-7d87-4ca2-9f3b-ce960169f035.nakama-0"}, {"userId": "0e070271-33e4-4cb8-9743-81fa26cab07f", "actorKind": "human", "matchId": "99fbbc26-7d87-4ca2-9f3b-ce960169f035.nakama-0", "mapId": "Lockdown", "collectionDay": "February_13", "x": -217.84458923339844, "y": 49.82606887817383, "z": 175.773193359375, "ts": 1770980227.0, "eventKind": "Position", "sourceFile": "February_13\\0e070271-33e4-4cb8-9743-81fa26cab07f_99fbbc26-7d87-4ca2-9f3b-ce960169f035.nakama-0"}, {"userId": "0e070271-33e4-4cb8-9743-81fa26cab07f", "actorKind": "human", "matchId": "99fbbc26-7d87-4ca2-9f3b-ce960169f035.nakama-0", "mapId": "Lockdown", "collectionDay": "February_13", "x": -224.64291381835938, "y": 49.075260162353516, "z": 191.3515167236328, "ts": 1770980232.0, "eventKind": "Position", "sourceFile": "February_13\\0e070271-33e4-4cb8-9743-81fa26cab07f_99fbbc26-7d87-4ca2-9f3b-ce960169f035.nakama-0"}, {"userId": "0e070271-33e4-4cb8-9743-81fa26cab07f", "actorKind": "human", "matchId": "99fbbc26-7d87-4ca2-9f3b-ce960169f035.nakama-0", "mapId": "Lockdown", "collectionDay": "February_13", "x": -222.56651306152344, "y": 49.075260162353516, "z": 188.1776885986328, "ts": 1770980242.0, "eventKind": "Position", "sourceFile": "February_13\\0e070271-33e4-4cb8-9743-81fa26cab07f_99fbbc26-7d87-4ca2-9f3b-ce960169f035.nakama-0"}, {"userId": "0e070271-33e4-4cb8-9743-81fa26cab07f", "actorKind": "human", "matchId": "99fbbc26-7d87-4ca2-9f3b-ce960169f035.nakama-0", "mapId": "Lockdown", "collectionDay": "February_13", "x": -222.56651306152344, "y": 49.075260162353516, "z": 188.01492309570312, "ts": 1770980323.0, "eventKind": "BotKilled", "sourceFile": "February_13\\0e070271-33e4-4cb8-9743-81fa26cab07f_99fbbc26-7d87-4ca2-9f3b-ce960169f035.nakama-0"}]}