{"matchId": "e9126370-9c2f-41c7-bae1-fe82504958d7.nakama-0", "mapId": "AmbroseValley", "collectionDay": "February_10", "humanCount": 1, "botCount": 0, "tsMin": 1770726436.0, "tsMax": 1770726531.0, "tsUnit": "ms", "events": [{"userId": "b3340cc5-c9fa-4108-b56d-0728bc978a22", "actorKind": "human", "matchId": "e9126370-9c2f-41c7-bae1-fe82504958d7.nakama-0", "mapId": "AmbroseValley", "collectionDay": "February_10", "x": -144.40586853027344, "y": 101.31999969482422, "z": -190.89541625976562, "ts": 1770726436.0, "eventKind": "Position", "sourceFile": "February_10\\b3340cc5-c9fa-4108-b56d-0728bc978a22_e9126370-9c2f-41c7-bae1-fe82504958d7.nakama-0"}, {"userId": "b3340cc5-c9fa-4108-b56d-0728bc978a22", "actorKind": "human", "matchId": "e9126370-9c2f-41c7-bae1-fe82504958d7.nakama-0", "mapId": "AmbroseValley", "collectionDay": "February_10", "x": -144.11203002929688, "y": 101.3873519897461, "z": -187.28848266601562, "ts": 1770726456.0, "eventKind": "Position", "sourceFile": "February_10\\b3340cc5-c9fa-4108-b56d-0728bc978a22_e9126370-9c2f-41c7-bae1-fe82504958d7.nakama-0"}, {"userId": "b3340cc5-c9fa-4108-b56d-0728bc978a22", "actorKind": "human", "matchId": "e9126370-9c2f-41c7-bae1-fe82504958d7.nakama-0", "mapId": "AmbroseValley", "collectionDay": "February_10", "x": -140.4440155029297, "y": 101.7249526977539, "z": -184.13307189941406, "ts": 1770726461.0, "eventKind": "Position", "sourceFile": "February_10\\b3340cc5-c9fa-4108-b56d-0728bc978a22_e9126370-9c2f-41c7-bae1-fe82504958d7.nakama-0"}, {"userId": "b3340cc5-c9fa-4108-b56d-0728bc978a22", "actorKind": "human", "matchId": "e9126370-9c2f-41c7-bae1-fe82504958d7.nakama-0", "mapId": "AmbroseValley", "collectionDay": "February_10", "x": -142.2497100830078, "y": 102.05059814453125, "z": -178.34320068359375, "ts": 1770726476.0, "eventKind": "Position", "sourceFile": "February_10\\b3340cc5-c9fa-4108-b56d-0728bc978a22_e9126370-9c2f-41c7-bae1-fe82504958d7.nakama-0"}, {"userId": "b3340cc5-c9fa-4108-b56d-0728bc978a22", "actorKind": "human", "matchId": "e9126370-9c2f-41c7-bae1-fe82504958d7.nakama-0", "mapId": "AmbroseValley", "collectionDay": "February_10", "x": -138.44692993164062, "y": 102.07315826416016, "z": -178.7916259765625, "ts": 1770726481.0, "eventKind": "Position", "sourceFile": "February_10\\b3340cc5-c9fa-4108-b56d-0728bc978a22_e9126370-9c2f-41c7-bae1-fe82504958d7.nakama-0"}, {"userId": "b3340cc5-c9fa-4108-b56d-0728bc978a22", "actorKind": "human", "matchId": "e9126370-9c2f-41c7-bae1-fe82504958d7.nakama-0", "mapId": "AmbroseValley", "collectionDay": "February_10", "x": -139.38705444335938, "y": 104.14425659179688, "z": -170.0384979248047, "ts": 1770726491.0, "eventKind": "Position", "sourceFile": "February_10\\b3340cc5-c9fa-4108-b56d-0728bc978a22_e9126370-9c2f-41c7-bae1-fe82504958d7.nakama-0"}, {"userId": "b3340cc5-c9fa-4108-b56d-0728bc978a22", "actorKind": "human", "matchId": "e9126370-9c2f-41c7-bae1-fe82504958d7.nakama-0", "mapId": "AmbroseValley", "collectionDay": "February_10", "x": -140.04519653320312, "y": 103.67626190185547, "z": -171.8575439453125, "ts": 1770726496.0, "eventKind": "Position", "sourceFile": "February_10\\b3340cc5-c9fa-4108-b56d-0728bc978a22_e9126370-9c2f-41c7-bae1-fe82504958d7.nakama-0"}, {"userId": "b3340cc5-c9fa-4108-b56d-0728bc978a22", "actorKind": "human", "matchId": "e9126370-9c2f-41c7-bae1-fe82504958d7.nakama-0", "mapId": "AmbroseValley", "collectionDay": "February_10", "x": -146.81333923339844, "y": 101.64417266845703, "z": -183.2290496826172, "ts": 1770726501.0, "eventKind": "Position", "sourceFile": "February_10\\b3340cc5-c9fa-4108-b56d-0728bc978a22_e9126370-9c2f-41c7-bae1-fe82504958d7.nakama-0"}, {"userId": "b3340cc5-c9fa-4108-b56d-0728bc978a22", "actorKind": "human", "matchId": "e9126370-9c2f-41c7-bae1-fe82504958d7.nakama-0", "mapId": "AmbroseValley", "collectionDay": "February_10", "x": -150.16378784179688, "y": 101.71517944335938, "z": -184.6995086669922, "ts": 1770726506.0, "eventKind": "Position", "sourceFile": "February_10\\b3340cc5-c9fa-4108-b56d-0728bc978a22_e9126370-9c2f-41c7-bae1-fe82504958d7.nakama-0"}, {"userId": "b3340cc5-c9fa-4108-b56d-0728bc978a22", "actorKind": "human", "matchId": "e9126370-9c2f-41c7-bae1-fe82504958d7.nakama-0", "mapId": "AmbroseValley", "collectionDay": "February_10", "x": -150.18154907226562, "y": 101.38394927978516, "z": -187.98658752441406, "ts": 1770726511.0, "eventKind": "Position", "sourceFile": "February_10\\b3340cc5-c9fa-4108-b56d-0728bc978a22_e9126370-9c2f-41c7-bae1-fe82504958d7.nakama-0"}, {"userId": "b3340cc5-c9fa-4108-b56d-0728bc978a22", "actorKind": "human", "matchId": "e9126370-9c2f-41c7-bae1-fe82504958d7.nakama-0", "mapId": "AmbroseValley", "collectionDay": "February_10", "x": -149.1028289794922, "y": 101.41617584228516, "z": -190.55227661132812, "ts": 1770726521.0, "eventKind": "Position", "sourceFile": "February_10\\b3340cc5-c9fa-4108-b56d-0728bc978a22_e9126370-9c2f-41c7-bae1-fe82504958d7.nakama-0"}, {"userId": "b3340cc5-c9fa-4108-b56d-0728bc978a22", "actorKind": "human", "matchId": "e9126370-9c2f-41c7-bae1-fe82504958d7.nakama-0", "mapId": "AmbroseValley", "collectionDay": "February_10", "x": -145.2453155517578, "y": 101.31843566894531, "z": -195.90725708007812, "ts": 1770726527.0, "eventKind": "BotKilled", "sourceFile": "February_10\\b3340cc5-c9fa-4108-b56d-0728bc978a22_e9126370-9c2f-41c7-bae1-fe82504958d7.nakama-0"}, {"userId": "b3340cc5-c9fa-4108-b56d-0728bc978a22", "actorKind": "human", "matchId": "e9126370-9c2f-41c7-bae1-fe82504958d7.nakama-0", "mapId": "AmbroseValley", "collectionDay": "February_10", "x": -144.9829864501953, "y": 101.31843566894531, "z": -196.09912109375, "ts": 1770726531.0, "eventKind": "Position", "sourceFile": "February_10\\b3340cc5-c9fa-4108-b56d-0728bc978a22_e9126370-9c2f-41c7-bae1-fe82504958d7.nakama-0"}]}